title,link,date
Man killed outside Florida Department of Corrections building in Miami Gardens,https://www.local10.com/news/florida/miami-dade/man-killed-outside-florida-department-of-corrections-building-in-miami-gardens,"June 19, 2019"
South Florida man says he was deceived when he bought tiny strip of land,https://www.local10.com/news/florida/broward/south-florida-man-says-he-was-deceived-when-he-bought-tiny-strip-of-land,"June 15, 2019"
"Florida man steals pool floats for sex 'instead of raping women,' police say",https://www.local10.com/news/florida/florida-man-steals-pool-floats-for-sex-instead-of-raping-women,"June 15, 2019"
Florida man wearing 'COKE' shirt busted for selling... coke (cocaine),https://www.local10.com/news/florida/florida-man-wearing-coke-shirt-busted-for-selling-coke,"June 12, 2019"
Man sentenced to 10 years for robbing Dylan's Candy Bar at gunpoint,https://www.local10.com/news/florida/miami-beach/man-sentenced-to-10-years-for-robbing-dylans-candy-bar-at-gunpoint,"June 19, 2019"
Man shot during robbery in South Florida,https://www.local10.com/video/man-shot-during-robbery-in-south-florida-video,"June 19, 2019"
"Florida man tells deputies cocaine on his nose is not his, officials say",https://www.local10.com/news/florida/florida-man-tells-deputies-cocaine-on-his-nose-is-not-his-officials-say,"June 10, 2019"
"Florida man brought home Georgia teen as sex slave, Feds say",https://www.local10.com/news/florida/florida-man-brought-home-georgia-teen-as-sex-slave-feds-say,"June 8, 2019"
"Keys man threatens co-workers with fillet knife, then strips naked, passes out",https://www.local10.com/news/florida/monroe-county/keys-man-threatens-co-workers-with-fillet-knife-then-strips-naked-passes-out,"June 22, 2019"
Fort Lauderdale man who dismembered father sentenced to 15 years in prison,https://www.local10.com/news/florida/palm-beach-county/fort-lauderdale-man-who-dismembered-father-sentenced-to-15-years-in-prison,"June 22, 2019"
Man issued trespassing warning after being spotted in doctor's coat at hospital,https://www.local10.com/news/florida/miami-dade/man-issued-trespassing-warning-after-being-spotted-in-doctor-s-coat-at-hospital,"June 13, 2019"
"Man tackled by Metrorail security guards for helping rider in need, witnesses say",https://www.local10.com/news/florida/miami-dade/man-tackled-by-metrorail-security-guards-for-helping-rider-in-need-witnesses-say,"June 20, 2019"
Motorcyclist killed by bolt of lightning in Florida,https://www.local10.com/weather/motorcyclist-killed-by-bolt-of-lightning-in-florida,"June 10, 2019"
Amber alert: Man abducts 16-year-old boy at gunpoint in Central Florida,https://www.local10.com/news/florida/amber-alert-man-abducts-16-year-old-boy-at-gunpoint-in-central-florida,"May 31, 2019"
Man fatally shoots self after leading police on chase,https://www.local10.com/news/florida/coral-gables/man-fatally-shoots-self-after-leading-police-on-chase,"June 19, 2019"
Tamarac man pleads guilty to threatening Democratic members of Congress,https://www.local10.com/news/florida/broward/tamarac-man-pleads-guilty-to-threatening-democratic-members-of-congress,"June 12, 2019"
Florida man threatens to eat eyes and tongues of cops,https://www.local10.com/news/florida/florida-man-threatens-to-eat-eyes-and-tongues-of-cops,"May 20, 2019"
Man shot during robbery in southwest Miami-Dade,https://www.local10.com/news/florida/miami-dade/man-shot-during-robbery-in-southwest-miami-dade,"June 19, 2019"
Florida man looking for owner of necklace filled with ashes,https://www.local10.com/news/florida/florida-man-looking-for-owner-of-necklace-filled-with-ashes,"May 28, 2019"
South Florida man convicted of brutally beating his roommate,https://www.local10.com/video/south-florida-man-convicted-of-brutally-beating-his-roommate,"June 12, 2019"
Webslinger gets day job! Spider-Man seen pressure cleaning Miramar roof,https://www.local10.com/news/florida/miramar/webslinger-gets-day-job-spider-man-seen-pressure-cleaning-miramar-roof,"June 17, 2019"
Local 10 finds cross in Normandy marking burial site of South Florida man's uncle,https://www.local10.com/news/military/local-10-finds-cross-in-normandy-marking-burial-site-of-south-florida-man-s-uncle,"June 11, 2019"
Man severely beaten during home-invasion robbery,https://www.local10.com/news/florida/miami-dade/man-severely-beaten-during-home-invasion-robbery,"June 17, 2019"
"Man walking on Interstate 95 struck, killed by car in Deerfield Beach",https://www.local10.com/news/florida/deerfield-beach/man-walking-on-interstate-95-struck-killed-by-car-in-deerfield-beach,"June 8, 2019"
Man killed in drive-by shooting in Miami Gardens,https://www.local10.com/news/florida/miami-dade/man-killed-in-drive-by-shooting-in-miami-gardens,"June 16, 2019"
"Man has been drinking alcohol before crashing into bicyclist, troopers say",https://www.local10.com/news/florida/miami-dade/man-has-been-drinking-alcohol-before-crashing-into-bicyclist-troopers-say,"June 14, 2019"
Florida man accidentally shoots self in Publix,https://www.local10.com/news/florida/florida-man-accidentally-shoots-self-in-publix,"May 5, 2019"
"South Florida plastic surgeon kidnapped, tortured with blowtorch, prosecutors say",https://www.local10.com/news/florida/broward/south-florida-plastic-surgeon-kidnapped-tortured-with-blowtorch-prosecutors-say,"June 13, 2019"
"Man accused of raping woman, stealing her jewelry at Davie home",https://www.local10.com/news/florida/broward/man-accused-of-raping-woman-stealing-her-jewelry-at-davie-home,"June 4, 2019"
"Florida man poses as FBI agent, dumps live catfish on woman's driveway",https://www.local10.com/news/weird-news/florida-man-poses-as-fbi-agent-dumps-live-catfish-on-womans-driveway,"May 15, 2019"
"Florida man arrested after slapping girlfriend with cheeseburger, deputies say",https://www.local10.com/news/florida/florida-man-arrested-after-slapping-girlfriend-with-cheeseburger-deputies-say,"May 14, 2019"
"Fort Lauderdale man kidnapped, assaulted tourist, police say",https://www.local10.com/news/florida/hollywood/fort-lauderdale-man-kidnapped-assaulted-tourist-police-say,"June 14, 2019"
Florida man prepares for C-47 jump during Normandy reenactment,https://www.local10.com/video/florida-man-prepares-for-c-47-jump-during-normandy-reenactment,"June 4, 2019"
"Man, 23, is latest to be arrested in connection with robbery that turned deadly",https://www.local10.com/news/florida/miami-dade/man-23-is-latest-to-be-arrested-in-connection-with-robbery-that-turned-deadly,"June 12, 2019"
Florida man takes bath in Wendy's kitchen sink,https://www.local10.com/news/florida/florida-man-takes-bath-in-wendys-kitchen-sink,"May 24, 2019"
"Man pretends to be fishing while casing homes in Weston, deputies say",https://www.local10.com/news/florida/weston/man-pretends-to-be-fishing-while-casing-homes-in-weston-deputies-say,"June 12, 2019"
"Man fatally shot in Tamarac, deputies say",https://www.local10.com/news/florida/broward/man-fatally-shot-in-tamarac-deputies-say,"June 12, 2019"
Fort Lauderdale man charged with 6 armed robberies in South Florida,https://www.local10.com/news/local/fort-lauderdale/fort-lauderdale-man-charged-with-6-armed-robberies-in-south-florida,"May 10, 2019"
Florida man charged with DUI on his lawn mower,https://www.local10.com/news/florida/florida-man-charged-with-dui-on-his-lawn-mower,"May 6, 2019"
"Florida baby delivered after man fatally shoots wife, police say",https://www.local10.com/news/florida/florida-baby-delivered-after-man-fatally-shoots-wife-police-say,"May 25, 2019"
Miami man accused of threatening to kill woman on Facebook,https://www.local10.com/news/florida/miramar/miami-man-accused-of-threatening-to-kill-woman-on-facebook,"June 11, 2019"
"West Park man accused of fighting Uber driver, nearly tearing ear off",https://www.local10.com/news/florida/broward/west-park-man-accused-of-fighting-uber-driver-nearly-tearing-ear-off,"June 11, 2019"
"Man, 28, pleads not guilty in Canadian couple's killings in Pompano Beach",https://www.local10.com/news/florida/broward/man-28-pleads-not-guilty-in-canadian-couples-killings-in-pompano-beach,"June 10, 2019"
"Man accused wife of infidelity before killing her, police say",https://www.local10.com/news/florida/plantation/man-accused-wife-of-infidelity-before-killing-her-police-say,"June 11, 2019"
"South Florida man stabs sleeping mother several times, deputies say",https://www.local10.com/news/florida/palm-beach-county/south-florida-man-stabs-sleeping-mother-several-times-deputies-say,"May 6, 2019"
Man shot in back in northwest Miami-Dade County neighborhood,https://www.local10.com/news/florida/miami-dade/man-shot-in-back-in-northwest-miami-dade-county-neighborhood,"June 10, 2019"
Florida man says passenger performed sex acts while he drove,https://www.local10.com/news/florida/florida-man-says-passenger-performed-sex-acts-while-he-drove,"May 22, 2019"
Man who killed driver in possible road-rage incident dies,https://www.local10.com/news/florida/broward/man-who-killed-driver-in-possible-road-rage-incident-dies,"June 9, 2019"
"Deerfield Beach man kills brother during dispute about money, deputies say",https://www.local10.com/news/florida/deerfield-beach/deerfield-beach-man-kills-brother-during-dispute-about-money-deputies-say,"June 10, 2019"
"Man barricades himself inside apartment after killing wife, police say",https://www.local10.com/news/florida/plantation/man-barricades-himself-inside-apartment-after-killing-wife-police-say,"June 9, 2019"
Arrest report sheds light on what occurred before elderly man charged with attempted murder,https://www.local10.com/news/florida/broward/arrest-report-sheds-light-on-what-occurred-before-elderly-man-charged-with-attempted-murder,"June 10, 2019"
South Florida man arrested after fatally shooting neighbor during dog dispute,https://www.local10.com/news/florida/palm-beach-county/south-florida-man-arrested-after-fatally-shooting-neighbor-during-dog-dispute,"April 26, 2019"
Florida man charged with making threats against Democratic lawmakers,https://www.local10.com/news/politics/florida-man-charged-with-making-threats-against-democratic-lawmakers,"April 19, 2019"
South Florida man waits 2 years to receive title for purchased motorcycle,https://www.local10.com/consumer/leave-it-to-layron/south-florida-man-waits-2-years-to-receive-title-for-purchased-motorcycle,"April 25, 2019"
Murder suspect mistakenly released from Florida jail,https://www.local10.com/news/national/murder-suspect-mistakenly-released-from-florida-jail-1,"June 4, 2019"
Man found safe after escaping from Pembroke Pines hospital,https://www.local10.com/news/florida/broward/man-found-safe-after-escaping-from-pembroke-pines-hospital,"May 20, 2019"
Man found shot in neck at Valero gas station in northwest Miami-Dade,https://www.local10.com/news/florida/miami-dade/man-found-shot-in-neck-at-valero-gas-station-in-northwest-miami-dade,"June 7, 2019"
Florida agency investigates after man shoos raccoon off boat,https://www.local10.com/news/florida/florida-agency-investigates-after-man-shoos-raccoon-off-boat-1,"May 11, 2019"
"Man sought in deaths of 2 women, child spotted in South Florida",https://www.local10.com/news/florida/police-hunt-for-man-accused-of-killing-2-women-wounding-girl,"April 13, 2019"
Florida man pretending to be cop pulls over undercover officer,https://www.local10.com/news/florida/florida-man-pretending-to-be-cop-pulls-over-undercover-officer,"April 18, 2019"
"Doral man arrested after California woman transfers $20,000 into his account",https://www.local10.com/news/florida/doral/doral-man-arrested-after-california-woman-transfers-20000-into-his-account,"June 7, 2019"
Man campaigning for Sweetwater mayoral candidate says someone shot at him,https://www.local10.com/news/florida/miami-dade/man-campaigning-for-sweetwater-mayoral-candidate-says-someone-shot-at-his-van,"May 21, 2019"
Florida man busted for singing dirty song to neighbor,https://www.local10.com/news/florida/florida-man-busted-for-singing-dirty-song-to-neighbor,"April 17, 2019"
Central Florida man sought in triple homicide turns himself in,https://www.local10.com/news/florida/central-florida-man-sought-in-triple-homicide-turns-himself-in,"April 14, 2019"
"Coral Springs man, 18, killed in I-95 crash in Oakland Park",https://www.local10.com/news/florida/broward/coral-springs-man-killed-in-i-95-crash-in-oakland-park,"May 15, 2019"
"Man accused in Pembroke Pines shootout also pointed gun at woman in Miramar, police say",https://www.local10.com/news/florida/broward/man-accused-in-pembroke-pines-shootout-also-pointed-gun-at-woman-in-miramar-police-say,"June 3, 2019"
"2 thieves rob man at Hollywood gas station before running him over, police say",https://www.local10.com/news/florida/hollywood/2-thieves-rob-man-at-hollywood-gas-station-before-running-him-over-police-say,"June 7, 2019"
Trial begins for man accused of severely beating roommate he met on Craigslist,https://www.local10.com/news/local/miami/trial-begins-for-man-accused-of-severely-beating-roommate-he-met-on-craigslist,"June 5, 2019"
Man shot to death at Miramar apartment complex,https://www.local10.com/news/florida/miramar/man-shot-to-death-at-miramar-apartment-complex,"June 3, 2019"
Man found dead inside abandoned building in Lauderhill,https://www.local10.com/news/florida/broward/man-found-dead-inside-abandoned-building-in-lauderhill,"June 5, 2019"
Florida man arrested after dining on spaghetti with his bare hands,https://www.local10.com/news/florida/florida-man-arrested-after-dining-on-spaghetti-with-his-bare-hands,"April 10, 2019"
Man accused of stealing Jeep from Stock Island home,https://www.local10.com/news/florida/monroe-county/man-accused-of-stealing-jeep-from-stock-island-home,"June 5, 2019"
Florida man threatens to destroy everyone... with army of turtles,https://www.local10.com/news/florida/florida-man-threatens-to-destroy-everyone-with-army-of-turtles,"April 9, 2019"
"Deputies: Man accidentally shoots, kills woman during foreplay",https://www.local10.com/news/national/deputies-man-accidentally-shoots-kills-woman-during-foreplay,"June 1, 2019"
Florida man arrested for murder moments after walking out of prison,https://www.local10.com/news/florida/florida-man-arrested-for-murder-moments-after-walking-out-of-prison,"April 8, 2019"
Man caught on camera stealing large package from southwest Miami-Dade home,https://www.local10.com/news/florida/miami-dade/man-caught-on-camera-stealing-large-package-from-southwest-miami-dade-home,"June 4, 2019"
"Man accused of luring police officers to apartment, then shooting at them",https://www.local10.com/news/florida/doral/man-accused-of-luring-police-officers-to-apartment-then-shooting-at-them,"June 4, 2019"
"Florida man freed from jail, immediately breaks into cars in jail parking lot",https://www.local10.com/news/florida/florida-man-freed-from-jail-immediately-breaks-into-cars-in-jail-parking-lot,"April 5, 2019"
Man shot in leg during attempted robbery at U-Gas station,https://www.local10.com/news/florida/miramar/man-shot-in-leg-during-attempted-robbery-at-u-gas-station,"June 3, 2019"
Man with paranoid schizophrenia reported missing from hospital,https://www.local10.com/news/florida/broward/man-with-paranoid-schizophrenia-reported-missing-from-hospital,"May 13, 2019"
"Man, child shot to death in pickup truck in Miami Gardens",https://www.local10.com/news/florida/miami-dade/man-child-shot-to-death-in-pickup-truck-in-miami-gardens,"June 3, 2019"
Florida man released from Venezuelan prison,https://www.local10.com/news/venezuela/florida-man-released-from-venezuelan-prison,"April 29, 2019"
Man sentenced to 90 days in jail for jumping on pelican in Florida Keys,https://www.local10.com/news/florida/monroe-county/man-sentenced-to-90-days-in-jail-for-jumping-on-pelican-in-florida-keys,"April 25, 2019"
South Florida man calls cops after being scammed over paid sex,https://www.local10.com/news/florida/south-florida-man-calls-cops-after-being-scammed-over-paid-sex,"March 26, 2019"
Hot sauce saves Florida man after car crashes into Taco Bell,https://www.local10.com/news/florida/hot-sauce-saves-florida-man-after-car-crashes-into-taco-bell,"March 19, 2019"
Man wanted on child porn charges in California arrested in Keys,https://www.local10.com/news/florida/monroe-county/man-wanted-on-child-porn-charges-in-california-arrested-in-keys,"May 6, 2019"
"Florida man kills pregnant stepmother, calls 911 at cemetery to confess, police say",https://www.local10.com/news/florida/florida-man-kills-pregnant-stepmother-calls-911-at-cemetery-to-confess-police-say,"March 22, 2019"
Man accused of taking pictures of women at FAU restroom,https://www.local10.com/news/florida/palm-beach-county/man-accused-of-taking-pictures-of-women-at-fau-restroom,"April 30, 2019"
Man fatally shot at northeast Miami-Dade condominium complex,https://www.local10.com/news/florida/miami-dade/man-fatally-shot-at-northeast-miami-dade-condominium-complex,"May 29, 2019"
Man suspected of killing wife takes his life in standoff with authorities,https://www.local10.com/news/florida/weston/man-suspected-of-killing-wife-takes-his-life-in-standoff-with-authorities,"May 3, 2019"
"South Florida man attacks mother who refused to dress his mannequin, deputies say",https://www.local10.com/news/florida/palm-beach-county/south-florida-man-attacks-mother-who-refused-to-dress-his-mannequin-deputies-say,"March 26, 2019"
Miami Beach removes art piece honoring man fatally shot by police,https://www.local10.com/news/florida/miami-beach/miami-beach-removes-art-piece-honoring-man-fatally-shot-by-police,"May 30, 2019"
2 teens arrested in fatal shooting of man during robbery in Opa-locka,https://www.local10.com/news/florida/opa-locka/2-teens-arrested-in-fatal-shooting-of-man-during-robbery-in-opa-locka,"May 30, 2019"
Deputies seek armed man in Pompano Beach carjacking,https://www.local10.com/news/florida/broward/deputies-seek-armed-man-in-pompano-beach-carjacking,"May 6, 2019"
"Man, woman shot while driving in northwest Miami-Dade",https://www.local10.com/news/florida/miami-dade/man-woman-shot-while-driving-in-northwest-miami-dade,"May 30, 2019"
"North Lauderdale man stabs father, stepmother before stabbing himself, deputies say",https://www.local10.com/news/florida/broward/north-lauderdale-man-stabs-father-stepmother-before-stabbing-himself-deputies-say,"May 28, 2019"
Texas man wanted in California child abduction arrested in Keys,https://www.local10.com/news/florida/monroe-county/texas-man-wanted-in-california-child-abduction-arrested-in-keys,"May 1, 2019"
Video shows man accused of attacking U.S. Marine veteran in Davie,https://www.local10.com/news/florida/broward/video-shows-man-accused-of-attacking-us-marine-in-davie,"May 29, 2019"
Man contracts flesh-eating bacteria in Florida,https://www.local10.com/health/man-contracts-flesheating-bacteria-in-florida,"April 29, 2019"
South Florida man accused of failing to deliver trucks purchased from him,https://www.local10.com/news/florida/miami-beach/south-florida-man-accused-of-failing-to-deliver-trucks-purchased-from-him,"March 14, 2019"
Meth smoking man attacks mattress in jealous rage,https://www.local10.com/news/florida/meth-smoking-man-attacks-mattress-in-jealous-rage,"April 27, 2019"
"Cassowary, a rare emu-like bird, kills Florida man",https://www.local10.com/news/national/cassowary-a-rare-emulike-bird-kills-florida-man,"April 14, 2019"
Police arrest Florida man pretending to be a deputy,https://www.local10.com/news/national/police-arrest-florida-man-pretending-to-be-a-deputy,"April 22, 2019"
Man dies after being shot during robbery in Opa-locka,https://www.local10.com/news/florida/opa-locka/man-dies-after-being-shot-during-robbery-in-opa-locka-police-say,"May 28, 2019"
TSA agents find non-working grenade launcher in Florida man's luggage,https://www.local10.com/news/florida/tsa-agents-find-non-working-grenade-launcher-in-florida-man-s-luggage,"March 5, 2019"
Florida man investigated after shooting shark,https://www.local10.com/news/national/florida-man-investigated-after-shooting-shark,"April 25, 2019"
"Man shot in apparent armed robbery in Opa-locka, police say",https://www.local10.com/news/florida/opa-locka/man-shot-in-apparent-armed-robbery-in-opa-locka-police-say,"May 27, 2019"
Tamarac man accused of threatening Democratic members of Congress,https://www.local10.com/news/florida/broward/tamarac-man-accused-of-threatening-democratic-members-of-congress,"April 19, 2019"
"Attacker fatally stabs man before killing himself, deputies say",https://www.local10.com/news/florida/broward/attacker-fatally-stabs-man-before-killing-himself-deputies-say,"May 26, 2019"
Florida man arrested minutes after being released from jail,https://www.local10.com/news/national/florida-man-arrested-minutes-after-being-released-from-jail,"April 7, 2019"
"New Jersey man chokes bar patron, grabs him by testicles, deputies say",https://www.local10.com/news/florida/monroe-county/new-jersey-man-chokes-bar-patron-grabs-him-by-testicles-deputies-say,"April 22, 2019"
Man killed in police-involved shooting in Davie,https://www.local10.com/news/florida/broward/man-killed-in-police-involved-shooting-in-davie,"May 17, 2019"
Man steals package containing debit cards from front of Pembroke Pines home,https://www.local10.com/news/florida/broward/man-steals-package-containing-debit-cards-from-front-of-pembroke-pines-home,"May 23, 2019"
Man says Fort Lauderdale police officer shot his brother in back,https://www.local10.com/news/local/fort-lauderdale/man-says-fort-lauderdale-police-officer-shot-his-brother-in-back,"June 22, 2019"
"Man surrenders in connection with hit-and-run crash in Medley, police say",https://www.local10.com/news/florida/miami-dade/man-surrenders-in-connection-with-hit-and-run-crash-in-medley-police-say,"May 22, 2019"
Video shows man in mosque day before he allegedly made threats,https://www.local10.com/news/florida/miami-dade/video-shows-man-in-mosque-day-before-he-allegedly-made-threats,"May 21, 2019"
Man arrested in connection with hit-and-run crash that killed pedestrian,https://www.local10.com/news/florida/miami-dade/man-arrested-in-connection-with-hit-and-run-crash-that-killed-pedestrian,"May 24, 2019"
Florida man arrested after recording himself having sex with his dog,https://www.local10.com/news/florida/florida-man-arrested-after-recording-himself-having-sex-with-his-dog,"February 12, 2019"
Man arrested after claiming he was shot at while campaigning in Sweetwater,https://www.local10.com/news/florida/miami-dade/man-arrested-after-claiming-he-was-shot-at-while-campaigning-in-sweetwater,"May 23, 2019"
"Florida man receives $980,000 tax refund after reporting $18,497 in wages",https://www.local10.com/news/florida/florida-man-receives-980-000-tax-refund-after-reporting-18-497-in-wages,"February 16, 2019"
"Man says he killed ex-girlfriend, her brothers because they 'kind of tortured' him",https://www.local10.com/news/florida/palm-beach-county/man-says-he-killed-ex-girlfriend-her-brothers-because-they-kind-of-tortured-him,"April 19, 2019"
Man arrested a week after escaping from Miami Beach police,https://www.local10.com/news/florida/miami-beach/man-arrested-a-week-after-escaping-from-miami-beach-police,"May 22, 2019"
Man found dead in Pembroke Park home,https://www.local10.com/news/florida/broward/man-found-dead-in-pembroke-park-home,"May 22, 2019"
"Boats burned, man seriously injured in suspicious fire in Florida Keys",https://www.local10.com/news/florida/monroe-county/boats-burned-man-seriously-injured-in-suspicious-fire-in-florida-keys,"February 11, 2019"
Hickey on girl's neck leads to arrest of South Florida man,https://www.local10.com/news/florida/palm-beach-county/hickey-on-girls-neck-leads-to-arrest-of-south-florida-man,"February 15, 2019"
Man shot and killed at apartment complex in Lauderhill,https://www.local10.com/news/florida/broward/man-shot-and-killed-at-apartment-complex-in-lauderhill,"May 21, 2019"
Florida man jailed for attacking man in 'Minions' costume,https://www.local10.com/news/florida/florida-man-jailed-for-attacking-man-in-minions-costume-22,"January 29, 2019"
Florida man dances through DUI sobriety test,https://www.local10.com/news/florida/florida-man-dances-through-dui-sobriety-test,"February 7, 2019"
Officers search for man with dreadlocks driving gray Volkswagen,https://www.local10.com/news/florida/broward/officers-search-for-man-with-dreadlocks-driving-gray-volkswagen,"May 17, 2019"
"Top Miami news: 1 critically injured in shooting; man shoots, kills brother over dispute; more",https://www.local10.com/community/top-miami-news-1-critically-injured-in-shooting-man-shoots-kills-brother-over-dispute-more,"May 17, 2019"
Man shot to death near Golden Glades Interchange,https://www.local10.com/news/florida/miami-dade/man-shot-to-death-near-golden-glades-interchange,"May 21, 2019"
"Suicidal man found safe, Pembroke Pines police say",https://www.local10.com/news/florida/broward/pembroke-pines-police-search-for-suicidal-man-possibly-armed-with-knife,"May 21, 2019"
"Florida man finds grenade, brings it to Taco Bell",https://www.local10.com/news/national/florida-man-finds-grenade-brings-it-to-taco-bell,"January 28, 2019"
"Off-duty Miami police officer shoots man, Miami-Dade police say",https://www.local10.com/news/florida/miami-dade/off-duty-miami-police-officer-shoots-man-miami-dade-police-say,"May 17, 2019"
Man stabbed during dispute at Taco Bell,https://www.local10.com/news/florida/miami-dade/man-stabbed-during-dispute-at-taco-bell,"May 21, 2019"
"Officers search for tall man wearing navy shirt, khaki pants",https://www.local10.com/news/florida/miami-dade/officers-search-for-tall-man-wearing-navy-shirt-khaki-pants,"May 24, 2019"
"80-year-old man foiled armed robbery by shooting attacker, police say",https://www.local10.com/news/florida/hialeah/80-year-old-man-foiled-armed-robbery-by-shooting-attacker-police-say,"May 18, 2019"
