title,link,date
Man accused of threatening worshipers of Miami Garden mosque,https://www.local10.com/news/florida/miami-dade/man-accused-of-threatening-worshipers-at-miami-garden-mosque,"May 21, 2019"
Florida man dies in Atlanta police chase,https://www.local10.com/news/florida-man-dies-in-atlanta-police-chase,"April 21, 2019"
Key Largo man accused of attacking landlord with baseball bat,https://www.local10.com/news/florida/monroe-county/key-largo-man-accused-of-attacking-landlord-with-baseball-bat,"May 14, 2019"
"Florida man, 85, attacked by gator in retirement community",https://www.local10.com/news/florida/florida-man-85-attacked-by-gator-in-retirement-community,"December 3, 2018"
"Sunrise man arrested on possession of child pornography charges, officials say",https://www.local10.com/news/florida/broward/sunrise-man-arrested-on-possession-of-child-pornography-charges-officials-say,"May 9, 2019"
"Florida man learns hard way he stole laxatives, not opioids",https://www.local10.com/news/florida/florida-man-learns-hard-way-he-stole-laxatives-not-opioids,"January 28, 2019"
"Man steals plants, flowers from woman's Miami garden",https://www.local10.com/news/local/miami/man-steals-plants-flowers-from-womans-miami-garden,"May 14, 2019"
Man arrested in connection with fatal shooting of 2 sisters near Liberty City,https://www.local10.com/news/florida/miami-dade/man-arrested-in-connection-with-fatal-shooting-of-2-sisters-near-liberty-city,"May 16, 2019"
"Florida man threatens to kill man 'with kindness,' uses machete named 'Kindness'",https://www.local10.com/news/florida/florida-man-threatens-to-kill-man-with-kindness-uses-machete-named-kindness,"January 14, 2019"
Man seen in video jumping on pelican booked into Key West jail,https://www.local10.com/news/florida/monroe-county/man-seen-in-video-jumping-on-pelican-booked-into-key-west-jail,"April 2, 2019"
Man hospitalized after shooting at Hialeah strip mall,https://www.local10.com/news/florida/hialeah/man-hospitalized-after-shooting-at-hialeah-strip-mall,"May 17, 2019"
Man calls Miami Beach bagel shop to unleash attack against Jews,https://www.local10.com/news/florida/miami-beach/man-calls-miami-beach-bagel-shop-to-unleash-attack-against-jews,"May 6, 2019"
Central Florida man wanted in triple murder spotted in Boynton Beach,https://www.local10.com/video/central-florida-man-wanted-in-triple-murder-spotted-in-boynton-beach,"April 14, 2019"
Man sentenced to 5 years in prison for 2016 DUI crash that killed young mother,https://www.local10.com/news/florida/miami-dade/man-sentenced-to-five-years-in-prison-for-2016-dui-crash-that-killed-young-mother,"April 9, 2019"
"Florida man drinks 20 beers, attempts to get children to touch him inappropriately",https://www.local10.com/news/florida/florida-man-drinks-20-beers-attempts-to-get-children-to-touch-him-inappropriately,"January 16, 2019"
Handcuffed man escapes from police in Miami Beach,https://www.local10.com/news/florida/miami-beach/handcuffed-man-escapes-from-officer-in-miami-beach-police-say,"May 14, 2019"
Man still recovering more than month after being struck by car,https://www.local10.com/news/florida/broward/man-still-recovering-more-than-a-month-after-being-struck-by-car,"April 4, 2019"
Florida man accused of being a fake doctor,https://www.local10.com/news/florida-man-accused-of-being-a-fake-doctor,"March 30, 2019"
Man arrested in connection with slew of South Florida robberies,https://www.local10.com/news/florida/hollywood/man-arrested-in-connection-with-slew-of-south-florida-robberies,"January 24, 2019"
"R. Kelly's ex-wife speaks to South Florida girls about domestic violence, sex trafficking",https://www.local10.com/news/florida/miami-dade/r-kelly-s-ex-wife-speaks-to-south-florida-girls-about-domestic-violence-sex-trafficking,"June 21, 2019"
"Man killed, woman wounded in shootout involving rappers",https://www.local10.com/news/florida/miami-dade/man-killed-woman-wounded-in-shootout-involving-rappers-in-sunny-isles-beach,"May 12, 2019"
"Face-eating suspect Austin Harrouff believed he was 'half-dog, half-man'",https://www.local10.com/news/florida/face-eating-suspect-austin-harrouff-believed-he-was-half-dog-half-man,"March 29, 2019"
Florida man arrested after argument over cheesesteak,https://www.local10.com/news/florida/florida-man-arrested-after-argument-over-cheesesteak,"January 8, 2019"
Miami-Dade man accused of neglecting over 200 farm animals,https://www.local10.com/news/florida/miami-dade/miami-dade-man-accused-of-neglecting-over-200-farm-animals,"April 30, 2019"
Florida man denies syringes found in rectum are his,https://www.local10.com/news/florida/florida-man-denies-syringes-found-in-rectum-are-his,"January 7, 2019"
Flesh-eating bacteria strike 2 men in Florida,https://www.local10.com/health/flesheating-bacteria-strike-2-men-in-florida,"May 1, 2019"
Firefighters find man dead during apartment fire in Wilton Manors,https://www.local10.com/news/florida/broward/firefighters-find-man-dead-during-house-fire-in-wilton-manors,"May 10, 2019"
"Florida woman sends man 159,000 texts after two went on one date",https://www.local10.com/news/national/florida-woman-sends-man-159-000-texts-after-two-went-on-one-date,"January 7, 2019"
"Angry about toll charges, Doral man threatens to blow up SunPass center, police say",https://www.local10.com/news/florida/doral/angry-about-toll-charges-doral-man-threatened-to-blow-up-sunpass-center-police-say,"April 4, 2019"
'We can do this!' Florida man declares in his plea for border wall funds,https://www.local10.com/news/florida/we-can-do-this-florida-man-declares-in-his-plea-for-border-wall-funds,"December 24, 2018"
Man turns the tables on pair of crooks trying to invade his home,https://www.local10.com/news/florida/miami-dade/man-turns-the-tables-on-pair-of-crooks-trying-to-invade-his-home,"March 28, 2019"
"Sex in front of police station, man says 'It was a Key West moment'",https://www.local10.com/news/florida/monroe-county/sex-in-front-of-police-station-man-says-it-was-a-key-west-moment,"May 2, 2019"
Of course 'Florida Man' drove his Ferrari off dock into the ocean,https://www.local10.com/news/florida/of-course-florida-man-drove-his-ferrari-off-dock-into-the-ocean,"January 3, 2019"
"VIDEO: Florida man doesn't get straw, attacks McDonald's employee",https://www.local10.com/news/florida/video-florida-man-doesnt-get-straw-attacks-mcdonalds-employee,"January 2, 2019"
Ex-boyfriend arrested after Wilton Manors man found dead in burning apartment,https://www.local10.com/news/florida/broward/ex-boyfriend-arrested-after-wilton-manors-man-found-dead-in-burning-apartment,"May 13, 2019"
"Man arrested after dozens of animals found in cargo area of U-Haul truck, police say",https://www.local10.com/news/florida/hollywood/man-arrested-after-dozens-of-animals-found-in-cargo-area-of-u-haul-truck-police-say,"May 13, 2019"
"Missouri man flees on golf cart, attacks deputies, paramedic in Florida Keys",https://www.local10.com/news/florida/monroe-county/missouri-man-flees-on-golf-cart-attacks-deputies-paramedic-in-florida-keys,"January 15, 2019"
Death of man found inside burning Wilton Manors apartment deemed suspicious,https://www.local10.com/news/florida/broward/death-of-man-found-inside-burning-wilton-manors-apartment-deemed-suspicious,"May 10, 2019"
Miami-Dade police officer fatally shoots armed man believed to have killed wife,https://www.local10.com/news/florida/miami-dade/miami-dade-police-officer-fatally-shoots-armed-man-believed-to-have-killed-wife,"May 1, 2019"
Man in Lakers shirt robs Chase Bank branch in Pompano Beach,https://www.local10.com/news/florida/broward/man-in-lakers-shirt-robs-chase-bank-branch-in-pompano-beach,"May 9, 2019"
South Florida man fears deportation after legally living in US for 16 years,https://www.local10.com/video/south-florida-man-fears-deportation-after-legally-living-in-us-for-16-years,"April 4, 2019"
Man arrested in alleged anti-Semitic attack in Bal Harbour,https://www.local10.com/news/florida/miami-dade/man-arrested-in-alleged-anti-semitic-attack-in-bal-harbour,"May 15, 2019"
Man accused of breaking into Wilton Manors thrift store,https://www.local10.com/news/florida/broward/man-accused-of-breaking-into-wilton-manors-thrift-store,"May 8, 2019"
Video of man jumping on pelican in Key West causes online uproar,https://www.local10.com/news/florida/monroe-county/video-of-man-jumping-on-pelican-in-key-west-causes-online-uproar,"March 10, 2019"
Florida deputies shoot and kill man holding meat cleaver,https://www.local10.com/news/crime/florida-deputies-shoot-and-kill-man-holding-meat-cleaver-19,"December 2, 2018"
Grieving man wants drunken driver in wife's death to suffer,https://www.local10.com/news/florida/hollywood/grieving-man-wants-drunken-driver-in-wifes-death-to-suffer,"May 15, 2019"
"Man, 72, from Pinellas County is latest to contract measles",https://www.local10.com/health/man-72-from-pinellas-county-is-latest-to-contract-measles,"April 25, 2019"
"Florida man kills wife, leaves body for children to find, sheriff says",https://www.local10.com/news/florida/florida-man-kills-wife-leaves-body-for-children-to-find-sheriff-says,"December 20, 2018"
Lauderhill man accused of recording up women's skirts at Sawgrass Mills,https://www.local10.com/news/florida/broward/lauderhill-man-accused-of-recording-up-womens-skirts-at-sawgrass-mills,"May 10, 2019"
Plantation man tells police he shot 'disrespectful' wife in face,https://www.local10.com/news/florida/plantation/plantation-man-tells-police-he-shot-disrespectful-wife-in-face,"May 10, 2019"
"Florida man arrested at Mar-a-lago, says he came to talk to Trump about 'his $6.3 trillion'",https://www.local10.com/news/florida/palm-beach-county/florida-man-arrested-at-mar-a-lago-says-he-came-to-talk-to-trump-about-his-63-trillion,"January 3, 2019"
Florida man who turned his life around after time in prison becomes a lawyer,https://www.local10.com/news/florida/palm-beach-county/florida-man-who-turned-his-life-around-after-time-in-prison-becomes-a-lawyer,"November 28, 2018"
Florida man arrested after naked chase,https://www.local10.com/news/florida/florida-man-arrested-after-naked-chase,"March 6, 2019"
Florida man offers to trade marijuana for food at McDonald's drive-thru,https://www.local10.com/news/florida/florida-man-offers-to-trade-marijuana-for-food-at-mcdonalds-drive-thru,"December 17, 2018"
Man hospitalized after being stabbed multiple times behind Hialeah strip mall,https://www.local10.com/news/florida/hialeah/man-stabbed-multiple-times-behind-hialeah-strip-mall,"May 5, 2019"
Florida officers buy man new bicycle after his was stolen,https://www.local10.com/news/florida/florida-officers-buy-man-new-bicycle-after-his-was-stolen,"February 18, 2019"
"Man robbed at gunpoint of cash, cellphone outside bank in Tamarac",https://www.local10.com/news/florida/broward/man-robbed-at-gunpoint-of-cash-cellphone-in-tamarac,"May 9, 2019"
"Man shot, killed after opening front door of Miami Gardens home",https://www.local10.com/news/florida/miami-dade/man-shot-killed-after-opening-front-door-of-miami-gardens-home,"May 9, 2019"
"Weston man sentenced to 5 ½ years in prison for bank robberies, attempted carjacking",https://www.local10.com/news/florida/broward/weston-man-sentenced-to-5-years-in-prison-for-bank-robberies-attempted-carjacking,"May 8, 2019"
Man accused of making threatening anti-Semitic calls to bagel shop,https://www.local10.com/news/florida/miami-beach/man-accused-of-making-threatening-anti-semitic-calls-to-bagel-shop,"May 8, 2019"
"FIU police searching for man who stole $15,000 in electronics",https://www.local10.com/news/florida/miami-dade/fiu-police-searching-for-man-who-stole-15000-electronics,"March 14, 2019"
Pompano Beach man arrested in FIU electronics theft,https://www.local10.com/news/florida/miami-dade/pompano-beach-man-arrested-in-fiu-electronics-theft,"March 21, 2019"
Man accused of trying to hit Lyft driver after car crash in Aventura,https://www.local10.com/news/florida/aventura/man-accused-of-trying-to-hit-lyft-driver-after-car-crash-in-aventura,"May 6, 2019"
