title,link
"Florida man eats meth to avoid arrest, doesn’t work",https://floridaman.com/florida-man-eats-meth-avoid-arrest-doesnt-work/
"Florida man is busted with $100k worth of stolen goods, hides drugs up butt",https://floridaman.com/moment-a-florida-man-is-busted-with-heroin-meth-and-100k-worth-of-stolen-goods-after-his/
"Florida Man says too much music, masturbation caused him to vandalize home",https://floridaman.com/florida-man-says-much-music-masturbation-caused-vandalize-home/
Florida Man Tries to Kiss Cottonmouth Snake,https://floridaman.com/florida-man-tries-kiss-cottonmouth-snake/
Florida Man Arrested for Serial Gropings on YouTube: “If You Don’t Touch Ass You’re Crazy”,https://floridaman.com/florida-man-arrested-serial-gropings-youtube-dont-touch-ass-youre-crazy/
Florida Man asks cop to jump start stolen truck,https://floridaman.com/florida-man-asks-cop-jump-start-stolen-truck/
"Florida Man Tries to Escape Cops On His Hoverboard, Fails",https://floridaman.com/florida-man-tries-escape-cops-hoverboard-fails/
Florida Man Tries To Buy $60000 BMW With Food Stamps,https://floridaman.com/florida-man-tries-buy-60000-bmw-suv-food-stamps/
Florida Man Had handcuff key in his butt during high speed chase,https://floridaman.com/florida-man-handcuff-key-butt-high-speed-chase/
"Florida Man Takes Fire Extinguisher off Hotel Wall, Sprays People",https://floridaman.com/florida-man-takes-fire-extinguisher-off-hotel-wall-sprays-people/
Florida Man hides 15 sticks of stolen deodorant in his pants,https://floridaman.com/florida-man-hides-15-sticks-stolen-deodorant-pants/
"Florida Man Orders Pit Bull To Attack Cops, Attacks Florida Man instead",https://floridaman.com/florida-man-orders-pit-bull-attack-cops-attacks-florida-man-instead/
Florida man can’t get car he wants to steal to start,https://floridaman.com/florida-man-cant-get-car-wants-steal-start-cops-say/
9.5-foot-long gator captured outside of Florida man’s door,https://floridaman.com/9-5-foot-long-gator-captured-outside-florida-mans-door/
Florida Man shoots at neighbours over feeding stray cats,https://floridaman.com/florida-man-shoots-neighbours-feeding-stray-cats/
Florida man brings machete to fist fight,https://floridaman.com/florida-man-brings-machete-fist-fight/
Florida Man holding “Death to America” sign Beat up by Americans,https://floridaman.com/florida-man-holding-death-america-sign-beat-americans/
Florida Woman Calls 911 Because Her Bacon Pizza Had Hamburger Instead,https://floridaman.com/customer-calls-911-bacon-pizza-hamburger-instead/
"Florida Man urinates on table, exposes self in church",https://floridaman.com/florida-man-urinates-table-exposes-self-church/
Stolen phone rings in pocket of suspected Florida Man,https://floridaman.com/stolen-phone-rings-pocket-suspected-florida-man/
Florida Man Drives Six Miles With Wife Atop Car,https://floridaman.com/florida-man-drives-six-miles-wife-atop-car/
"Florida Man Claims to be William Shatner’s son, sues for $170 million",https://floridaman.com/william-shatner-sued-for-170-million-by-man-claiming-to-be-his-son/
Florida man attacks his mom’s door with a pitchfork,https://floridaman.com/florida-man-attacks-his-moms-door-with-a-pitchfork/
"Florida Man Jailed After Reporting For Jury Duty Drunk, Supreme Court Reverses",https://floridaman.com/florida-man-jailed-reporting-jury-duty-drunk-supreme-court-reverses/
Florida man grabs police Taser after being tased five times,https://floridaman.com/florida-man-grabs-police-taser-after-being-tased-five-times/
Florida Man accused of stealing wallets leaves his own at the scene,https://floridaman.com/man-accused-of-stealing-wallets-leaves-his-own-at-the-scene/
"Florida Man points spear gun at boaters in Keys, cops say",https://floridaman.com/man-points-spear-gun-at-boaters-in-keys-cops-say/
Florida Man throws Gator into restaurant,https://floridaman.com/man-arrested-for-the-perfect-florida-crime/
"Florida Man Reports Dead Body by Taking Skull to Publix, Using It as a Hand Puppet",https://floridaman.com/reports-dead-body-skull-publix-using-hand-puppet/
